{
  "schema": "diff_review_v1",
  "id": "review_20261017T215531_b920a23b",
  "spec_id": "o2-diff-review",
  "created_at": "2026-10-17T21:55:31.786674+00:00",
  "verdict": "approve",
  "findings": [],
  "precheck": {
    "required_paths": [
      "orchestr8/config/diff_review.schema.json",
      "orchestr8/services/diff_review.py",
      "orchestr8/scripts/review_diff.py",
      "orchestr8/demo_diff_review.py",
      "docs/backlog.md"
    ],
    "missing_paths": [],
    "test_paths": [
      "orchestr8/demo_diff_review.py",
      "tests/test_orchestr8_diff_review.py"
    ],
    "diff_stats": {
      "files": [
        "docs/backlog.md",
        "orchestr8/config/diff_review.schema.json",
        "orchestr8/demo_diff_review.py",
        "orchestr8/scripts/review_diff.py",
        "orchestr8/services/diff_review.py",
        "tests/test_orchestr8_diff_review.py"
      ],
      "additions": 808,
      "deletions": 7,
      "chars": 36479,
      "truncated": false
    }
  },
  "council": {
    "run_id": "run_20261017T215531_5fe474e4",
    "roles": [
      "critic",
      "tester",
      "domain_expert"
    ],
    "vetoed": false,
    "verdict": "approve",
    "summary": "Challenge Council: approved."
  },
  "provenance": {
    "source": "orchestr8.diff_review",
    "method": "rule_precheck+challenge_council",
    "rule_version": "diff_review_v1",
    "confidence": 0.7,
    "verification": "council_reviewed"
  }
}